{
  "schema_version": "3.0.0",
  "checkpoint_id": "fixture-checkpoint-id",
  "scope": {
    "tenant_id": "fixture-tenant",
    "project_id": "fixture-amplai"
  },
  "run_id": "fixture-run-id",
  "contract_ref": {
    "id": "fixture-ref",
    "revision": 1,
    "digest": "sha256:bc87b130fe6e2fb0156bdda50d7d14562db83b58199490694266def47b41773d"
  },
  "graph_ref": {
    "id": "fixture-ref",
    "revision": 1,
    "digest": "sha256:bc87b130fe6e2fb0156bdda50d7d14562db83b58199490694266def47b41773d"
  },
  "context_bundle_ref": {
    "id": "fixture-ref",
    "revision": 1,
    "digest": "sha256:bc87b130fe6e2fb0156bdda50d7d14562db83b58199490694266def47b41773d"
  },
  "workspace_base_ref": {
    "id": "fixture-ref",
    "revision": 1,
    "digest": "sha256:bc87b130fe6e2fb0156bdda50d7d14562db83b58199490694266def47b41773d"
  },
  "workspace_diff_artifact": {
    "id": "fixture-artifact",
    "digest": "sha256:dcd22167f3ab965bf7a07fd2dd6a6dda553357bc1810049d35cd223026cb20a5",
    "media_type": "application/json",
    "size_bytes": 256
  },
  "last_accepted_seq": 1,
  "pending_calls": [],
  "steering_cursor": 1,
  "budget_reservation_ref": {
    "id": "fixture-ref",
    "revision": 1,
    "digest": "sha256:bc87b130fe6e2fb0156bdda50d7d14562db83b58199490694266def47b41773d"
  },
  "driver_session_handle": "fixture-driver-session-handle",
  "driver_profile_ref": {
    "id": "fixture-ref",
    "revision": 1,
    "digest": "sha256:bc87b130fe6e2fb0156bdda50d7d14562db83b58199490694266def47b41773d"
  },
  "sandbox_recipe_ref": {
    "id": "fixture-ref",
    "revision": 1,
    "digest": "sha256:bc87b130fe6e2fb0156bdda50d7d14562db83b58199490694266def47b41773d"
  },
  "created_at": "2026-09-15T13:30:00Z"
}
